{
  "kind": "evidence",
  "evidence_id": "E-2025-0001",
  "intent_id": "I-2025-0001",
  "base_state": {
    "type": "git",
    "ref": "b7c1f5a2"
  },
  "candidate_state": {
    "type": "git",
    "ref": "c4d9a1f0"
  },
  "producer": {
    "actor_id": "agent-ci",
    "actor_type": "agent",
    "display_name": "CI Runner"
  },
  "overall_status": "pass",
  "evaluations": [
    {
      "constraint_id": "C-SEC-001",
      "status": "pass",
      "summary": "Secret scan passed",
      "artifacts": [
        {
          "uri": "https://example.com/artifacts/scans/secret-scan-0001.json",
          "media_type": "application/json",
          "digest": { "algo": "sha256", "hash": "abababababababababababababababababababababababababababababababab" }
        }
      ]
    }
  ],
  "simulation": {
    "simulation_id": "SIM-2025-0001",
    "environment": "linux-x86_64",
    "started_at": "2025-01-15T12:40:00Z",
    "ended_at": "2025-01-15T12:44:00Z",
    "artifacts": [
      {
        "uri": "https://example.com/artifacts/tests/unit-test-report.xml",
        "media_type": "application/xml",
        "digest": { "algo": "sha256", "hash": "cdcdcdcdcdcdcdcdcdcdcdcdcdcdcdcdcdcdcdcdcdcdcdcdcdcdcdcdcdcdcdcdcd" }
      }
    ]
  },
  "created_at": "2025-01-15T12:45:30Z"
}
